{
  "schema": "loveqigu.admin.art_requirement.v1",
  "version": "1.0.0",
  "art_requirement_id": "cp_scaling_025_art_requirement",
  "source_checkpoint": "cp_scaling_025",
  "asset_type": "placeholder_art",
  "asset_name": "chapter_scaling_test checkpoint 25 art brief",
  "asset_description": "Scaling validation art brief. Zero story progression effect.",
  "priority": "low",
  "status": "queued",
  "canonical_boundary": "Art queue artifact only."
}
